{
  "$schema": "https://json-schema.org/draft/2020-12/schema",
  "$id": "https://grandchallenge.dev/intellect/schemas/council_review.schema.json",
  "title": "Grand Intellect Council office review",
  "type": "object",
  "additionalProperties": false,
  "required": [
    "schema_version", "matter_id", "matter_sha256", "office", "reviewer_id",
    "decision", "deliberation", "discharged_obligations", "findings",
    "conditions", "residual_uncertainty", "evidence_refs"
  ],
  "properties": {
    "schema_version": {"const": "1.0"},
    "matter_id": {"type": "string", "minLength": 1},
    "matter_sha256": {"type": "string", "pattern": "^[0-9a-f]{64}$"},
    "office": {"enum": ["axiomatist", "cartographer", "verifier", "adversary", "formalist", "steward", "grammarian", "composer", "amanuensis", "referee"]},
    "reviewer_id": {"type": "string", "minLength": 1},
    "decision": {"enum": ["approve", "approve_with_conditions", "changes_requested", "reject", "abstain"]},
    "deliberation": {"type": "string", "minLength": 1},
    "discharged_obligations": {"type": "array", "minItems": 1, "items": {"type": "string", "minLength": 1}},
    "findings": {"type": "array", "items": {"type": "string", "minLength": 1}},
    "conditions": {"type": "array", "items": {"type": "string", "minLength": 1}},
    "residual_uncertainty": {"type": "array", "items": {"type": "string", "minLength": 1}},
    "evidence_refs": {"type": "array", "items": {"type": "string", "minLength": 1}}
  }
}
