{
  "schema_version": "1.0",
  "matter_id": "GI-COUNCIL-RSI-CCC-001",
  "matter_sha256": "2cf5801a9cfd974b8ff94f8330794b7c75ba4c6b5909182f61c6c09b54ae1ad2",
  "office": "composer",
  "reviewer_id": "openai-gpt-5.6-sol-council-composer-gi-council-rsi-ccc-001",
  "decision": "approve_with_conditions",
  "deliberation": "Pass metadata: reviewer_system_id=openai-gpt-5.6-sol; logical_pass_id=GI-COUNCIL-RSI-CCC-001/composer/read-only-v1; mode=non_authoring_read_only; exact_subject=matter_sha256:2cf5801a9cfd974b8ff94f8330794b7c75ba4c6b5909182f61c6c09b54ae1ad2. The proposal's components form a coherent architecture only if they are integrated through one exact formal object. The strongest design feature is the promotion gate that forbids mixing a theorem about one model, a demonstration of another, and a trust-boundary account of a third.",
  "discharged_obligations": [
    "Assess coherence among the mathematical model, checker, executable demonstration, and governance boundary.",
    "Ensure the outputs compose into one end-to-end claim rather than a collection of adjacent artifacts."
  ],
  "findings": [
    "The generate-to-replace loop is coherent as a governed pipeline with authorization after certification.",
    "The fixed verification/admission kernel provides the integration anchor for the bounded mechanism.",
    "The same-object promotion gate should be treated as a hard failure condition."
  ],
  "conditions": [
    "Use one content-addressed WP00 manifest to bind the categorical model, formal theorem source, checker, executable demonstration, policy and Q definition, fixtures, and trust-boundary statement. Any material component change must invalidate prior integrated evidence."
  ],
  "residual_uncertainty": [
    "Cross-language semantic drift between proof assistant, checker implementation, and demonstration remains a principal integration risk."
  ],
  "evidence_refs": [
    "grandchallenge/INTELLECT@fc9ee5537bf07586dffcc621e753204ecd835365:CONSTITUTION.md",
    "grandchallenge/INTELLECT@14c00503d88efeb4c2f3de796b8f07bf1f9352cd:governance/council_matters/GI-COUNCIL-RSI-CCC-001/proposal.md"
  ]
}
