{
  "schema_version": "1.0",
  "matter_id": "GI-COUNCIL-RSI-CCC-001",
  "matter_sha256": "2cf5801a9cfd974b8ff94f8330794b7c75ba4c6b5909182f61c6c09b54ae1ad2",
  "office": "amanuensis",
  "reviewer_id": "openai-gpt-5.6-sol-council-amanuensis-gi-council-rsi-ccc-001",
  "decision": "approve_with_conditions",
  "deliberation": "Pass metadata: reviewer_system_id=openai-gpt-5.6-sol; logical_pass_id=GI-COUNCIL-RSI-CCC-001/amanuensis/read-only-v1; mode=non_authoring_read_only; exact_subject=matter_sha256:2cf5801a9cfd974b8ff94f8330794b7c75ba4c6b5909182f61c6c09b54ae1ad2. The intake packet is durably identified by matter and proposal digests and states its authority boundary. WP00 should preserve the same provenance discipline for every promoted artifact, including explicit supersession when the formal object changes.",
  "discharged_obligations": [
    "Check inscription, provenance, inheritance, exact-subject binding, and future retrieval.",
    "Ensure later research results can be traced back to this intake without granting the intake itself theorem authority."
  ],
  "findings": [
    "The matter separates Council advice, Human Steward reserved disposition, mathematical certification, and production activation.",
    "The proposal digest and exact intake commit provide a stable starting inscription.",
    "Later records need a single manifest lineage so rejected or superseded models cannot be mistaken for the admitted object."
  ],
  "conditions": [
    "Create a durable WP00 manifest and decision lineage containing exact hashes for the model, theorem, checker, executable demonstration, evaluation context, fixtures, reports, Council and Human dispositions, and any superseding revisions."
  ],
  "residual_uncertainty": [
    "The final repository placement of the research work package is not specified by this intake and must be recorded when admitted."
  ],
  "evidence_refs": [
    "grandchallenge/INTELLECT@fc9ee5537bf07586dffcc621e753204ecd835365:governance/constitutional_authority_schedule.json",
    "grandchallenge/INTELLECT@14c00503d88efeb4c2f3de796b8f07bf1f9352cd:governance/council_matters/GI-COUNCIL-RSI-CCC-001/matter.json",
    "grandchallenge/INTELLECT@14c00503d88efeb4c2f3de796b8f07bf1f9352cd:governance/council_matters/GI-COUNCIL-RSI-CCC-001/proposal.md",
    "proposal_sha256:fb7edd874841d02b5dcb81d711f28cec7f8661da09569d795e855a91d1cd50bc"
  ]
}
