{
  "schema_version": "1.0",
  "matter_id": "GI-COUNCIL-RSI-CCC-001",
  "matter_sha256": "2cf5801a9cfd974b8ff94f8330794b7c75ba4c6b5909182f61c6c09b54ae1ad2",
  "office": "cartographer",
  "reviewer_id": "openai-gpt-5.6-sol-council-cartographer-gi-council-rsi-ccc-001",
  "decision": "approve_with_conditions",
  "deliberation": "Pass metadata: reviewer_system_id=openai-gpt-5.6-sol; logical_pass_id=GI-COUNCIL-RSI-CCC-001/cartographer/read-only-v1; mode=non_authoring_read_only; exact_subject=matter_sha256:2cf5801a9cfd974b8ff94f8330794b7c75ba4c6b5909182f61c6c09b54ae1ad2. The dependency graph is intelligible: guarded categorical semantics supports staged recursion; typed program representation supports inspection; refinement and quality orders support admission; a small checker mediates replacement; a bounded executable model confronts the formal claim. The main dependency risk is allowing independently sensible components to drift into different formal objects.",
  "discharged_obligations": [
    "Map the mathematical and executable dependencies required by WP00.",
    "Identify dependency-order and interface risks that could invalidate an end-to-end claim."
  ],
  "findings": [
    "The promotion gate requiring the model, theorem, demonstration, and trust-boundary statement to refer to one exact object is the critical integration control.",
    "The likely highest-risk interfaces are Prog/run adequacy, refinement compatibility with categorical structure, and certificate semantics for Q."
  ],
  "conditions": [
    "Create a dependency manifest before mechanization that names the chosen model, formalization environment, certificate language, executable reference model, and exact interfaces among them."
  ],
  "residual_uncertainty": [
    "Availability and maturity of library support for the selected guarded categorical model remain unknown until WP00 chooses its mechanization stack."
  ],
  "evidence_refs": [
    "grandchallenge/INTELLECT@fc9ee5537bf07586dffcc621e753204ecd835365:CONSTITUTION.md",
    "grandchallenge/INTELLECT@fc9ee5537bf07586dffcc621e753204ecd835365:governance/steward_directives/GI-STEWARD-0003.md",
    "grandchallenge/INTELLECT@14c00503d88efeb4c2f3de796b8f07bf1f9352cd:governance/council_matters/GI-COUNCIL-RSI-CCC-001/proposal.md",
    "proposal_sha256:fb7edd874841d02b5dcb81d711f28cec7f8661da09569d795e855a91d1cd50bc"
  ]
}
